Last login: Fri Jan 13 15:25:03 on ttys000

The default interactive shell is now zsh.
To update your account to use zsh, please run `chsh -s /bin/zsh`.
For more details, please visit https://support.apple.com/kb/HT208050.
L-XNTL4N67CH:~ lopamudrapanda$ /Library/PostgreSQL/15/scripts/runpsql.sh; exit
Server [localhost]: 
Database [postgres]: 
Port [5432]: 
Username [postgres]: postgres
Password for user postgres: 
psql (15.1)
Type "help" for help.

postgres=# \c dbfinserv
You are now connected to database "dbfinserv" as user "postgres".
dbfinserv=# create table employee1;
ERROR:  syntax error at or near ";"
LINE 1: create table employee1;
                              ^
dbfinserv=# create table employee1(id primary key not null, name, salary);
ERROR:  syntax error at or near "primary"
LINE 1: create table employee1(id primary key not null, name, salary...
                                  ^
dbfinserv=# create table employee1(id int primary key not null, name text, salar
y int);
CREATE TABLE
dbfinserv=# insert into employee1 values(1,'Lopa',35000);
INSERT 0 1
dbfinserv=# intsert into employee1 values(2,'Mukesh',35000),(3,'Joshita',35000); 
ERROR:  syntax error at or near "intsert"
LINE 1: intsert into employee1 values(2,'Mukesh',35000),(3,'Joshita'...
        ^
dbfinserv=# insert into employee1 values(2,'Mukesh',35000),(3,'Joshita',35000);
INSERT 0 2
dbfinserv=# insert into employee1 values(4,'Chaitnya',35000),(5,'Kiruthick',35000);
INSERT 0 2
dbfinserv=# \dt employee1
           List of relations
 Schema |   Name    | Type  |  Owner   
--------+-----------+-------+----------
 public | employee1 | table | postgres
(1 row)

dbfinserv=# select * from employee1;
 id |   name    | salary 
----+-----------+--------
  1 | Lopa      |  35000
  2 | Mukesh    |  35000
  3 | Joshita   |  35000
  4 | Chaitnya  |  35000
  5 | Kiruthick |  35000
(5 rows)

dbfinserv=# select avg(salary) as avg of salary from emlpoyee1;
ERROR:  syntax error at or near "of"
LINE 1: select avg(salary) as avg of salary from emlpoyee1;
                                  ^
dbfinserv=# select avg(salary) as avgsalary from emlpoyee1;
ERROR:  relation "emlpoyee1" does not exist
LINE 1: select avg(salary) as avgsalary from emlpoyee1;
                                             ^
dbfinserv=# select avg(salary) as avgsalary from employee1;
     avgsalary      
--------------------
 35000.000000000000
(1 row)

dbfinserv=# select distinct salary from employee1;
 salary 
--------
  35000
(1 row)

dbfinserv=# select count(salary) from employee1 group by salary;
 count 
-------
     5
(1 row)

dbfinserv=# update employee set salary=null;
ERROR:  column "salary" of relation "employee" does not exist
LINE 1: update employee set salary=null;
                            ^
dbfinserv=# update employee1 set salary=null;
UPDATE 5
dbfinserv=# select * from employee1;
 id |   name    | salary 
----+-----------+--------
  1 | Lopa      |       
  2 | Mukesh    |       
  3 | Joshita   |       
  4 | Chaitnya  |       
  5 | Kiruthick |       
(5 rows)

dbfinserv=# select * from employee1 order by asc;
ERROR:  syntax error at or near "asc"
LINE 1: select * from employee1 order by asc;
                                         ^
dbfinserv=# select * from employee1 order by;
ERROR:  syntax error at or near ";"
LINE 1: select * from employee1 order by;
                                        ^
dbfinserv=# select * from employee1 order by name;
 id |   name    | salary 
----+-----------+--------
  4 | Chaitnya  |       
  3 | Joshita   |       
  5 | Kiruthick |       
  1 | Lopa      |       
  2 | Mukesh    |       
(5 rows)

dbfinserv=# select * from employee1 order by name desc;
 id |   name    | salary 
----+-----------+--------
  2 | Mukesh    |       
  1 | Lopa      |       
  5 | Kiruthick |       
  3 | Joshita   |       
  4 | Chaitnya  |       
(5 rows)

dbfinserv=# select * from employee1 where name='Lopa';
 id | name | salary 
----+------+--------
  1 | Lopa |       
(1 row)

dbfinserv=# select id e, name e, id e1, salary e1 from employee inner join employee 1;
ERROR:  syntax error at or near "1"
LINE 1: ...ame e, id e1, salary e1 from employee inner join employee 1;
                                                                     ^
dbfinserv=# select id e, name e, id e1, salary e1 from employee inner join employee1;
ERROR:  syntax error at or near ";"
LINE 1: ...name e, id e1, salary e1 from employee inner join employee1;
                                                                      ^
dbfinserv=# select id e, name e, id e1, salary e1 from employee e inner join employee1 where e.id=e1.id;
ERROR:  syntax error at or near "where"
LINE 1: ...1, salary e1 from employee e inner join employee1 where e.id...
                                                             ^
dbfinserv=# select id e, name e, id e1, salary e1 from employee e inner join employee1 on e.id=e1.id;
ERROR:  missing FROM-clause entry for table "e1"
LINE 1: ...alary e1 from employee e inner join employee1 on e.id=e1.id;
                                                                 ^
dbfinserv=# create table department(dept_name text, dept_id int);
CREATE TABLE
dbfinserv=# alter table employee1 add column dept_id int foreign key;
ERROR:  syntax error at or near "foreign"
LINE 1: alter table employee1 add column dept_id int foreign key;
                                                     ^
dbfinserv=# alter table employee1 add column dept_id int;
ALTER TABLE
dbfinserv=# alter table employee1 add foreign key(dept_id);
ERROR:  syntax error at or near ";"
LINE 1: alter table employee1 add foreign key(dept_id);
                                                      ^
dbfinserv=# alter table employee1 add foreign key(dept_id);
ERROR:  syntax error at or near ";"
LINE 1: alter table employee1 add foreign key(dept_id);
                                                      ^
dbfinserv=# alter table department add primary key(dept_id);
ALTER TABLE
dbfinserv=# alter table employee1 add foreign key(dept_id);
ERROR:  syntax error at or near ";"
LINE 1: alter table employee1 add foreign key(dept_id);
                                                      ^
dbfinserv=# alter table employee1 add foreign key(dept_id) references department(dept_id);
ALTER TABLE
dbfinserv=# select * from employee1;
 id |   name    | salary | dept_id 
----+-----------+--------+---------
  1 | Lopa      |        |        
  2 | Mukesh    |        |        
  3 | Joshita   |        |        
  4 | Chaitnya  |        |        
  5 | Kiruthick |        |        
(5 rows)

dbfinserv=# insert into employee1(salary, dept_id) values(35000,1),(35500,1),(35000,3),(35000,3),(35000,2);
ERROR:  null value in column "id" of relation "employee1" violates not-null constraint
DETAIL:  Failing row contains (null, null, 35000, 1).
dbfinserv=# insert into department values (cse, 1),(ece,2),(cse,2),(mech ,3),(cse,1);
ERROR:  column "cse" does not exist
LINE 1: insert into department values (cse, 1),(ece,2),(cse,2),(mech...
                                       ^
dbfinserv=# insert into department values ('cse', 1),('ece',2),('cse',2),('mech'
 ,3),('cse',1);
ERROR:  duplicate key value violates unique constraint "department_pkey"
DETAIL:  Key (dept_id)=(2) already exists.
dbfinserv=# insert into department values ('cse', 1),('ece',2),('cse',3),('mech'
 ,4),('cse',5);
INSERT 0 5
dbfinserv=# update employee set dept_id=1 where id=1;
ERROR:  column "dept_id" of relation "employee" does not exist
LINE 1: update employee set dept_id=1 where id=1;
                            ^
dbfinserv=# update employee1 set dept_id=1 where id=1;
UPDATE 1
dbfinserv=# update employee1 set dept_id=1 where id=2;
UPDATE 1
dbfinserv=# update employee1 set dept_id=2 where id=3;
UPDATE 1
dbfinserv=# update employee1 set dept_id=3 where id=4;
UPDATE 1
dbfinserv=# update employee1 set dept_id=4 where id=5;
UPDATE 1
dbfinserv=# update employee1 set salary=35000;
UPDATE 5
dbfinserv=# select * from employee1;
 id |   name    | salary | dept_id 
----+-----------+--------+---------
  1 | Lopa      |  35000 |       1
  2 | Mukesh    |  35000 |       1
  3 | Joshita   |  35000 |       2
  4 | Chaitnya  |  35000 |       3
  5 | Kiruthick |  35000 |       4
(5 rows)

dbfinserv=# select * from department;
 dept_name | dept_id 
-----------+---------
 cse       |       1
 ece       |       2
 cse       |       3
 mech      |       4
 cse       |       5
(5 rows)

dbfinserv=# update employee1 set dept_id=null where id=2;
UPDATE 1
dbfinserv=# select * from employee1;
 id |   name    | salary | dept_id 
----+-----------+--------+---------
  1 | Lopa      |  35000 |       1
  3 | Joshita   |  35000 |       2
  4 | Chaitnya  |  35000 |       3
  5 | Kiruthick |  35000 |       4
  2 | Mukesh    |  35000 |        
(5 rows)

dbfinserv=# select * from employee1 order by id;
 id |   name    | salary | dept_id 
----+-----------+--------+---------
  1 | Lopa      |  35000 |       1
  2 | Mukesh    |  35000 |        
  3 | Joshita   |  35000 |       2
  4 | Chaitnya  |  35000 |       3
  5 | Kiruthick |  35000 |       4
(5 rows)

dbfinserv=# select id e, name e, dept_name d from employee1 e inner join department d where d.dept_id=e.dept_id;
ERROR:  syntax error at or near "where"
LINE 1: ...t_name d from employee1 e inner join department d where d.de...
                                                             ^
dbfinserv=# select id e, name e, dept_name d from employee1 e inner join department d on d.dept_id=e.dept_id;
 e |     e     |  d   
---+-----------+------
 1 | Lopa      | cse
 3 | Joshita   | ece
 4 | Chaitnya  | cse
 5 | Kiruthick | mech
(4 rows)

dbfinserv=# select id e as emp_id, name e as emp_name, dept_name d as dept_name
from employee1
ERROR:  syntax error at or near "as"
LINE 1: select id e as emp_id, name e as emp_name, dept_name d as de...
                    ^
dbfinserv=# select id e, name e, dept_name d from employee1 e inner join department d on d.dept_id=e.dept_id;
 e |     e     |  d   
---+-----------+------
 1 | Lopa      | cse
 3 | Joshita   | ece
 4 | Chaitnya  | cse
 5 | Kiruthick | mech
(4 rows)

dbfinserv=# 
